Xpath;Nome;Definição;Tipo de dado;Tamanho;Mandatoriedade;Formato;Domínio;Mínimo de Ocorrências;Máximo de Ocorrências;Restrições;Nulidade;Tipo Dado Json
GET /accounts/{accountId}/balances;;Método para obter os saldos da conta de depósito à vista, poupança ou pagamento pré-paga identificada por accountId mantida pelo cliente na instituição transmissora;;;;;;;;;;
data/;;Conjunto de informações das Contas de: depósito à vista, poupança e de pagamento pré-paga;Objeto;;Obrigatório;;;1;1;Não há restrição;;Objeto
data/availableAmount;availableAmount;Saldo disponível para utilização imediata. No caso de conta de depósito a vista, sem considerar cheque especial e investimentos atrelados a conta. Admite saldo negativo. Expresso em valor monetário com 4 casas decimais;Número;19;Obrigatório;;;1;1;Não há restrição;Aceita nulo;Double
data/availableAmountCurrency;availableAmountCurrency;Moeda referente ao valor do saldo disponível, segundo modelo ISO-4217. p.ex. 'BRL';Texto;3;Obrigatório;;;1;1;Pode ser preenchido com “NA” caso a instituição não possua a informação.;;String
data/blockedAmount;blockedAmount;Saldo bloqueado, não disponível para utilização imediata, por motivo de bloqueio apresentado para o cliente nos canais eletrônicos Expresso em valor monetário com 4 casas decimais;Número;19;Obrigatório;;;1;1;Não há restrição;Aceita nulo;Double
data/blockedAmountCurrency;blockedAmountCurrency;Moeda referente ao valor do saldo bloqueado, segundo modelo ISO-4217. p.ex. 'BRL';Texto;3;Obrigatório;;;1;1;Pode ser preenchido com “NA” caso a instituição não possua a informação.;;String
data/automaticallyInvestedAmount;automaticallyInvestedAmount;Saldo disponível com aplicação automática - corresponde a soma do saldo disponível acrescido do valor obtido a partir da aplicação automática Expresso em valor monetário com 4 casas decimais;Número;19;Obrigatório;;;1;1;Não há restrição;Aceita nulo;Double
data/automaticallyInvestedAmountCurrency;automaticallyInvestedAmountCurrency;Moeda referente ao valor do saldo disponível com aplicação automática, segundo modelo ISO-4217. p.ex. 'BRL';Texto;3;Obrigatório;;;1;1;Pode ser preenchido com “NA” caso a instituição não possua a informação.;;String
